name,freereturns,items_sold,item_status,shipping_price,item_price
New ListingHot-selling White Bullseye LP Custom Electric Guitar 2H Pickups Gold Hardware,False,,Brand New,0,24900
New ListingAria Pro II PE-1500 AB 1980 Made in Japan Sunburst Electric Guitar with Case,True,,Pre-Owned,0,455100
Yellow Flame Maple Top PRS Electric Guitar Santana Retro 2H Pickup Abalone Inlay,False,,Brand New,2500,28670
"New ListingSquier ""Custom Shack "" Hard Tail Strat, Custom Wiring,Capacitor Upgrade, Nice",False,,Pre-Owned,3499,22499
Armada-Style Electric Guitar - Dual Humbuckers/Chrome Hardware + Basswood Body,False,,Brand New,7998,21375
Busuyi VRack 6 String Electric Guitar Sunburst With Black Pickguard,False,,Brand New,0,14800
Customized Firebird Metallic Gold Electric Guitar Mahogany Body Upright Tuners,False,,Brand New,2500,29877
New ListingExplorer Electric Guitar white HH pickup hardware Black fingerboard,True,,Brand New,0,26900
New ListingEpiphone Les Paul Custom Standard Lefty Safe Packing!,False,,Pre-Owned,0,57500
New ListingTV Yellow Double Cutaway LP Junior Electric Guitar 2P90 Pickups Fast Delivery,False,,Brand New,0,28800
New ListingSAMICK LSR-25,False,,Pre-Owned,4000,14999
"New ListingLP electric guitar, solid body HH pickups, tremolo bridge, tobacco color",False,,Brand New,0,39900
New Listing6 Strings Metal Red Electric Guitar with P 90 Pickups Rosewood Fretboard,False,,Brand New,0,32500
PRS SE SANTANA standard in Pearl WHITE made In KOREA P33,True,,Pre-Owned,0,42999
"Black BB-King ""Lucille"" Model Jazz Electric Guitar Gold Hardware Professional",False,,Brand New,0,30510
New Listing1983 Electra Phoenix • Duncans • Floyd Rose • Alvarez Hard Case,False,,Pre-Owned,7500,44999
Custom 6 String SG Electric Guitar Colored Shell Inlay Bind Frets ABR Bridge Red,False,,Brand New,0,33700
Movall MP-104 Falling Star Modulated Delay Effects Pedal - Afford-a-Board !!!!!!,False,7 sold,Brand New,0,3349
New ListingHot-selling The new electric guitar wiring hole red has excellent expressiveness,False,,Brand New,0,30000
Guild M-75 Aristocrat Hollowbody Electric Guitar - Black,False,,Brand New,0,119900
New ListingIbanez Artcore AS53 Semi-hollowbody Electric Guitar - Tobacco Flat,True,,Very Good - Refurbished,0,35199
New ListingYamaha Revstar Standard RSS02T Electric Guitar - Swift Blue,True,,Very Good - Refurbished,0,64239
Custom Les Paul Junior Electric Guitar Heritage Cherry P90 Left Handed Solid,False,,Brand New,2000,24516
Limited Run Crimson Ice Gray Figured LP Electric Guitar 3 Piece Flame,False,,Brand New,0,29300
New ListingEpiphone Les Paul Prophecy Black Aged Gloss Safe Packing!,False,,Pre-Owned,0,87407
New ListingGuild M-75 Aristocrat Hollowbody Electric Guitar - Black,True,,Very Good - Refurbished,0,74712
#3 Pete Townshend Deluxe Gold Top ’76 Electric Guitar Number 3 Mahogany Body,False,,Brand New,1000,24800
Unfinished Firebird Electric Guitar DIY Mahogany Body Mini Pickup Neck Thru Body,False,,Brand New,0,23900
